{
  "$schema": "https://json-schema.org/draft/2020-12/schema",
  "type": "object",
  "properties": {
    "name": {
      "type": "string"
    },
    "role": {
      "type": "string"
    },
    "text": {
      "type": "string"
    },
    "rating": {
      "default": 5,
      "type": "number",
      "minimum": 1,
      "maximum": 5
    },
    "image": {
      "type": "string"
    },
    "videoUrl": {
      "type": "string",
      "format": "uri"
    },
    "$schema": {
      "type": "string"
    }
  },
  "required": [
    "name",
    "role",
    "text",
    "image"
  ]
}