{
  "name": "Jorge Escalona (Korke)",
  "role": "Bachata Sensual Creator",
  "text": "Hello everybody, Patricia and Stephan are an amazing couple. They are teaching regular classes of Bachata Sensual Official in Regensburg. Don't miss them and become the best follower and leader.",
  "rating": 5,
  "image": "../../assets/images/testimonials/jorge.png",
  "videoUrl": "https://www.instagram.com/reel/Crp9VoXIT6F/?igshid=MTIyMzRjYmRlZg=="
}
