{
  "name": "Hugo A.",
  "role": "Bachatero",
  "text": "Patricia und Stephan sind lustig, fleißig und leidenschaftlich beim Tanzen und in den Kursen. Sie bilden sich viel weiter und entwickeln sich stetig. Zusammen unterrichten sie einen aktuellen und social tauglichen Bachata-Stil, und teilen ihre gesamten Erfahrungen im Kurs. Ich habe viel Spaß und lerne viel mit ihnen.",
  "rating": 5,
  "image": "../../assets/images/testimonials/hugo.png"
}
