{
  "name": "Susy K.",
  "role": "Ehemalige Schülerin",
  "text": "Hey Stephan! Ich wollt mich grad nochmal bei dir bedanken dafür dass ich bei euch Bachata lernen durfte und natürlich für die ganzen Social Tänze! Hab grad in Mexiko den 2. Platz bei nem Social Wettbewerb gewonnen. Völlig unerwartet wirklich Danke dafür! Mach weiter so.",
  "rating": 5,
  "image": "../../assets/images/testimonials/susy.png"
}
